wallet,label,amount_luciiid,unlock_start,unlock_end,notes
Hzq3vGpLNsdCWeD5jQ5MvcBSXNkpi3bQRiz7YGVoLUJr,Main Reserve / Treasury,167659521.53,2025-11-07,2027-11-07,Gradual release for development and ecosystem support
8BKodS5PojxAyEFMuL35MiAbxUqmSmFps5EKZBM9a9BV,Treasury / Growth Wallet,35100000,2025-11-07,2026-11-07,Marketing & partnership budget unlocked over 12 months
GJAa3HHTgEYoutoDkg9WptCgNYscwHWPy79if9gcsKD2,Ops / Airdrop Wallet,497770,2025-11-07,2025-12-31,Short-term community rewards and testing
A89fh5EohAknKvoQBHauHaWcfzSTqsTK8AFU18mbNdm,Liquidity Pool (Locked),755867278.48,2025-11-07,2099-01-01,Permanent lock managed by Moonshot / Meteora.ag
public,Community Float (Holders),40875430,2025-10-23,∞,Freely circulating supply held by community